{
  "format_id": "talking_head_short",
  "name": "Talking-head short",
  "description": "20-60s vertical short from talking-head footage. Strong hook in the first 1.5s, contiguous source range preferred, conservative jump cuts, readable captions.",
  "min_duration_seconds": 20,
  "max_duration_seconds": 60,
  "target_duration_seconds": 38,
  "aspect": "9:16",
  "platforms": ["youtube_short", "tiktok", "instagram_reel"],
  "hook_window_seconds": 1.5,
  "prefer_contiguous": true,
  "caption_style": "clean_white",
  "autopilot_enabled": false
}
