{
  "format_id": "promotional_short",
  "name": "Promotional short",
  "description": "15-45s vertical promo with explicit CTA. Claims must be backed by CLAIMS_AND_PROOF.md; unsupported claims are penalized in scoring.",
  "min_duration_seconds": 15,
  "max_duration_seconds": 45,
  "target_duration_seconds": 30,
  "aspect": "9:16",
  "platforms": ["instagram_reel", "tiktok", "youtube_short"],
  "hook_window_seconds": 1.5,
  "prefer_contiguous": true,
  "caption_style": "high_contrast_social",
  "autopilot_enabled": false
}
